timestep,speaker,text,summary
0:00:00,Bank Agent,"Good afternoon, Mr. Wilson! I reviewed your portfolio. You've built a solid foundation—congrats!","The transcript involves a bank agent congratulating a client, Mr. Wilson, after reviewing his portfolio and recognizing that he has established a strong financial foundation."
0:00:07,Mr. Wilson,Thanks. That's good to hear. I've been putting money aside for years… just hoping it's enough.,"The transcript features a brief conversation between a bank agent and Mr. Wilson. The agent congratulates Mr. Wilson on successfully building a strong financial portfolio, while Mr. Wilson expresses gratitude and shares that he's been saving diligently for years in hopes that his efforts are sufficient."
0:00:12,Bank Agent,"Based on our projections, if you retire at 65, your current savings and investments should give you a very comfortable lifestyle.","The transcript features a conversation between a bank agent and Mr. Wilson. The agent reviews Mr. Wilson's financial portfolio, compliments his solid foundation, and assures him that his current savings and investments are sufficient to support a comfortable lifestyle in retirement at age 65. Mr. Wilson expresses satisfaction with this reassurance, noting his years of saving in preparation."
0:00:20,Mr. Wilson,"That's a relief. Honestly, I've been worried I'd outlive my savings.","The transcript contains a conversation between a bank agent and Mr. Wilson about his financial portfolio and retirement planning. The agent commends Mr. Wilson on his solid savings foundation and assures him that, based on projections, his current savings and investments will support a comfortable lifestyle if he retires at 65. Mr. Wilson expresses relief, as he had been concerned about outliving his savings."
0:00:26,Bank Agent,"I understand. Though, if healthcare costs rise or the market dips, we might need to make small adjustments.",The transcript captures a conversation between a bank agent and Mr. Wilson regarding his financial portfolio and future retirement plans. The agent assures Mr. Wilson that his savings and investments are sufficient to support a comfortable lifestyle if he retires at 65. Mr. Wilson expresses relief but also mentions concerns about potentially outliving his savings. The agent acknowledges his concerns and notes that adjustments might be needed in response to factors like rising healthcare costs or market fluctuations.
0:00:32,Mr. Wilson,Adjustments? I thought I was set. Now I'm not so sure…,"The transcript captures a conversation between a bank agent and Mr. Wilson discussing Mr. Wilson's retirement savings. The agent commends Mr. Wilson on building a solid financial foundation and assures him that his savings and investments should provide a comfortable retirement if he retires at 65. However, the agent notes potential risks, such as rising healthcare costs or market downturns, which may require adjustments. Mr. Wilson, initially relieved, begins to feel uncertain about his financial security due to these concerns."
0:00:37,Bank Agent,"It's normal to feel that way. But we can create a flexible plan—include a cushion for those surprises, maybe stagger withdrawals, or adjust your risk exposure slightly.","The transcript details a conversation between a bank agent and Mr. Wilson regarding his retirement savings. The agent commends Mr. Wilson on building a solid financial foundation, reassuring him that his current savings and investments should comfortably support his retirement at age 65. However, the agent notes potential challenges, such as rising healthcare costs or market fluctuations, which might require small adjustments to his plan. Mr. Wilson expresses concern over these uncertainties but is assured by the agent that they can create a flexible strategy to manage these risks and ensure financial security in retirement."
0:00:49,Mr. Wilson,Okay… that makes sense. I just want to enjoy retirement without constantly worrying.,"The transcript captures a conversation between a bank agent and Mr. Wilson regarding his retirement planning. The bank agent congratulates Mr. Wilson on his solid financial foundation and assures him that his current savings and investments should allow for a comfortable retirement at age 65. However, the agent cautions that potential challenges, such as rising healthcare costs or market fluctuations, may require minor adjustments to his plan. Mr. Wilson expresses concern over these uncertainties but is reassured by the agent's suggestion to create a flexible plan that includes contingencies, staggered withdrawals, and adjusted risk management. Ultimately, Mr. Wilson seeks peace of mind to enjoy his retirement without financial worries."
0:00:56,Bank Agent,"And you will. With the right strategy, your retirement years can be both secure and fulfilling.","In this transcript, a bank agent and Mr. Wilson discuss his retirement readiness. The agent reviews Mr. Wilson's financial portfolio and assures him that his savings and investments should afford him a comfortable lifestyle if he retires at 65. Mr. Wilson expresses concerns about outliving his savings, particularly with potential healthcare cost increases or market fluctuations. The agent explains that while such uncertainties exist, they can be managed by creating a flexible retirement plan, including building a financial cushion, adjusting withdrawals, and modifying risk exposure. Mr. Wilson is reassured and expresses a desire for a worry-free retirement. The agent emphasizes that the right strategy will ensure security and fulfillment during his retirement years."
0:01:02,Mr. Wilson,Alright. Let's do it.,"The transcript captures a conversation between a bank agent and Mr. Wilson about his retirement planning. The agent praises Mr. Wilson for building a solid financial foundation and assures him that his savings and investments should support a comfortable lifestyle if he retires at 65. However, they caution that factors like rising healthcare costs or market fluctuations might require minor adjustments to his plan. Mr. Wilson expresses concern about not being as ""set"" as he thought and his desire for a worry-free retirement. The agent reassures him, offering to create a flexible plan with strategies like staggered withdrawals and adjusted risk exposure to prepare for uncertainties. Mr. Wilson agrees to proceed, aiming for a secure and enjoyable retirement."
